<?xml version="1.0" encoding="UTF-8"?>
<project xmlns="http://modelfactory.knapptech.com/ModelDefinition"
xmlns:xsi="http://www.w3.org/2001/XMLSchema-instance"
xsi:schemaLocation="http://modelfactory.knapptech.com/ModelDefinition ../ModelDefinition.xsd" 
name="MyApplication">
	<defaults>
		<language>java</language>
		<mergeStrategy>merge</mergeStrategy>
	</defaults>
	<package name="com">
		<package name="mycompanyname">
			<package name="myapplicationname">
				<interface name="MyInterface">
					<requiredmethod name="interfacesRequiredMethod"/>
				</interface>
				<enum name="MyEnum">
					
				</enum>
				<class name="MyClass" strategy="bean">
					<field name="myField" type="int" />
					<requiredmethod name="myRequiredMethod" />
				</class>
			</package>
		</package>
	</package>
</project>